{
  "schema_version":"cgu-presentations/2",
  "title":"Проверка текста и шкал",
  "demo":true,
  "sources":[],
  "slides":[
    {"id":"text","kind":"text","title":"Текст и специальные символы","body":"Кириллица: ё, й, щ, ъ.\n\nЧисла: 1 250,5; 80%; −15; 25 ₽.\n\nДлинная строка должна переноситься по словам и оставаться внутри безопасной области слайда.\n\nЭто демонстрационный текст для проверки шрифта Golos Text."},
    {"id":"signed-bar","kind":"chart","title":"Нулевые и отрицательные значения","unit":"Условные единицы / тестовые значения","categories":["А","Б","В","Г"],"series":[{"name":"Изменение","values":[0,-5,2,10]}]},
    {"id":"signed-line","kind":"chart","chart_type":"line","title":"Линия сохраняет знак и ноль","unit":"Условные единицы / тестовые значения","categories":["Янв","Фев","Мар","Апр"],"series":[{"name":"Изменение","values":[0,-5,2,10]}]}
  ]
}
