{
  "schema_version": "cgu-presentations/2",
  "title": "Библиотека композиций ЦГУ",
  "demo": true,
  "sources": [],
  "slides": [
    {
      "id": "metrics",
      "kind": "kpi_grid",
      "title": "Показатели проекта",
      "items": [
        {
          "value": "80%",
          "label": "Заявок обработано",
          "detail": "За отчётный месяц. Доля от всех поступивших заявок."
        },
        {
          "value": "−15%",
          "label": "Время обработки",
          "detail": "Изменение относительно предыдущего периода."
        },
        {
          "value": "0",
          "label": "Критических ошибок",
          "detail": "По результатам контрольной проверки."
        }
      ]
    },
    {
      "id": "compare",
      "kind": "comparison",
      "title": "Сравнение двух вариантов работы",
      "columns": [
        {
          "title": "Текущий порядок",
          "items": [
            "Заявки поступают по электронной почте",
            "Ответственный назначается вручную",
            "Статус уточняется у исполнителя"
          ]
        },
        {
          "title": "Предлагаемый порядок",
          "items": [
            "Заявки поступают через единую форму",
            "Ответственный определяется по категории",
            "Статус доступен в карточке заявки"
          ]
        }
      ]
    },
    {
      "id": "roadmap",
      "kind": "roadmap",
      "title": "Этапы запуска проекта",
      "steps": [
        {
          "title": "Анализ задачи",
          "period": "Неделя 1",
          "body": "Собрать требования и ограничения."
        },
        {
          "title": "Прототип",
          "period": "Неделя 2",
          "body": "Проверить основной сценарий."
        },
        {
          "title": "Подготовка пилота",
          "period": "Неделя 3",
          "body": "Настроить доступ и данные."
        },
        {
          "title": "Пилот",
          "period": "Неделя 4",
          "body": "Провести проверку с пользователями."
        },
        {
          "title": "Оценка результатов",
          "period": "Неделя 5",
          "body": "Сопоставить результаты с критериями."
        },
        {
          "title": "Запуск",
          "period": "Неделя 6",
          "body": "Принять решение о расширении."
        }
      ]
    },
    {
      "id": "labeled",
      "kind": "diagram",
      "title": "Передача заявки между участниками",
      "nodes": [
        {
          "id": "user",
          "text": "Заявитель",
          "box": [
            150,
            460,
            360,
            150
          ]
        },
        {
          "id": "service",
          "text": "Сервис",
          "box": [
            780,
            460,
            360,
            150
          ],
          "accent": true
        },
        {
          "id": "team",
          "text": "Исполнитель",
          "box": [
            1410,
            460,
            360,
            150
          ]
        }
      ],
      "edges": [
        {
          "from": "user",
          "to": "service",
          "label": "Заявка",
          "label_box": [
            560,
            375,
            170,
            65
          ]
        },
        {
          "from": "service",
          "to": "team",
          "label": "Задание",
          "label_box": [
            1190,
            375,
            170,
            65
          ]
        }
      ]
    },
    {
      "id": "repeated",
      "kind": "kpi_grid",
      "title": "Повторное использование композиции",
      "items": [
        {
          "value": "12",
          "label": "Проверенных сценариев",
          "detail": "Демонстрация повторного использования макета."
        },
        {
          "value": "4",
          "label": "Участника проверки",
          "detail": "Вымышленные данные для тестирования библиотеки."
        }
      ]
    }
  ]
}
