{
  "schema_version": "cgu-presentations/2",
  "title": "Обработка обращений",
  "demo": true,
  "sources": [{"id":"demo","location":"Синтетические данные для проверки скилла. Не показатели ДИТ."}],
  "slides": [
    {"id":"cover","kind":"cover","title":"Обработка\nобращений","subtitle":"Демонстрационный сценарий\nПример работы с шаблоном ЦГУ","notes":"Все сведения в этой презентации вымышлены и используются для тестирования."},
    {"id":"overview","kind":"cards","title":"Четыре этапа обработки обращения","items":[{"title":"Приём","body":"Житель заполняет форму.\nСистема регистрирует обращение."},{"title":"Проверка","body":"Оператор проверяет сведения\nи уточняет недостающие данные."},{"title":"Исполнение","body":"Профильная команда решает вопрос\nи фиксирует результат."},{"title":"Ответ","body":"Житель получает уведомление.\nОбращение переходит в архив."}]},
    {"id":"kpi","kind":"kpi","title":"80% обращений закрыты в срок","value":"80%","label":"Доля обращений, закрытых в срок\nДемонстрационный период","detail_title":"Как рассчитан показатель","detail":"Из 100 тестовых обращений\n80 закрыты в установленный срок.\n\nРасчёт: 80 / 100 × 100%.\nОставшиеся 20 требуют разбора.","notes":"Демонстрационная арифметика: 80 из 100. Не фактическая статистика."},
    {"id":"process","kind":"process","title":"Маршрут обращения","steps":[{"title":"Приём","body":"Регистрация\nи номер обращения"},{"title":"Проверка","body":"Проверка данных\nи маршрутизация"},{"title":"Исполнение","body":"Решение вопроса\nпрофильной командой"},{"title":"Ответ","body":"Уведомление жителя\nи закрытие"}]},
    {"id":"architecture","kind":"diagram","title":"Схема взаимодействия систем","nodes":[{"id":"portal","text":"Портал\nжителя","box":[100,475,340,190]},{"id":"api","text":"Сервис\nобращений","box":[700,475,390,190],"accent":true},{"id":"registry","text":"Реестр\nобращений","box":[1430,300,390,180]},{"id":"notify","text":"Сервис\nуведомлений","box":[1430,690,390,180]}],"edges":[{"from":"portal","to":"api"},{"from":"api","to":"registry"},{"from":"api","to":"notify"}],"notes":"Концептуальная схема для тестирования. Стрелки показывают передачу данных, не реальную архитектуру ДИТ."},
    {"id":"chart","kind":"chart","title":"Количество обращений по месяцам","unit":"Обращения, шт. / демонстрационные данные","categories":["Январь","Февраль","Март","Апрель"],"series":[{"name":"Поступило","values":[100,120,90,140]},{"name":"Закрыто","values":[80,110,85,130]}]},
    {"id":"table","kind":"table","title":"Результаты за демонстрационный период","columns":["Месяц","Поступило, шт.","Закрыто, шт."],"rows":[["Январь","100","80"],["Февраль","120","110"],["Март","90","85"],["Апрель","140","130"]]}
  ]
}
