{
  "schema_version": "cgu-presentations/2",
  "title": "Библиотека текстовых блоков",
  "demo": true,
  "sources": [],
  "slides": [
    {
      "id": "open-columns",
      "kind": "text_blocks",
      "variant": "numbered_columns",
      "title": "Три самостоятельных тезиса",
      "items": [
        {
          "title": "Название блока 1",
          "body": "Краткое пояснение к тезису. Здесь можно раскрыть одну самостоятельную мысль."
        },
        {
          "title": "Название блока 2",
          "body": "Краткое пояснение к тезису. Здесь можно раскрыть одну самостоятельную мысль."
        },
        {
          "title": "Название блока 3",
          "body": "Краткое пояснение к тезису. Здесь можно раскрыть одну самостоятельную мысль."
        }
      ]
    },
    {
      "id": "card-grid",
      "kind": "text_blocks",
      "variant": "cards_grid",
      "title": "Пять блоков в одной композиции",
      "items": [
        {
          "title": "Название блока 1",
          "body": "Краткое пояснение к тезису. Здесь можно раскрыть одну самостоятельную мысль."
        },
        {
          "title": "Название блока 2",
          "body": "Краткое пояснение к тезису. Здесь можно раскрыть одну самостоятельную мысль."
        },
        {
          "title": "Название блока 3",
          "body": "Краткое пояснение к тезису. Здесь можно раскрыть одну самостоятельную мысль."
        },
        {
          "title": "Название блока 4",
          "body": "Краткое пояснение к тезису. Здесь можно раскрыть одну самостоятельную мысль."
        },
        {
          "title": "Название блока 5",
          "body": "Краткое пояснение к тезису. Здесь можно раскрыть одну самостоятельную мысль."
        }
      ]
    },
    {
      "id": "shared-conclusion",
      "kind": "text_blocks",
      "variant": "columns_callout",
      "title": "Текстовые блоки с общим выводом",
      "items": [
        {
          "title": "Название блока 1",
          "body": "Краткое пояснение к тезису. Здесь можно раскрыть одну самостоятельную мысль."
        },
        {
          "title": "Название блока 2",
          "body": "Краткое пояснение к тезису. Здесь можно раскрыть одну самостоятельную мысль."
        },
        {
          "title": "Название блока 3",
          "body": "Краткое пояснение к тезису. Здесь можно раскрыть одну самостоятельную мысль."
        }
      ],
      "callout": "Общий вывод объединяет содержание карточек в одну мысль."
    },
    {
      "id": "split",
      "kind": "text_blocks",
      "variant": "split_panel",
      "title": "Контекст и главный акцент",
      "items": [
        {
          "title": "Описание ситуации",
          "body": "Нейтральное пояснение раскрывает контекст. Здесь достаточно 2 коротких предложений."
        },
        {
          "title": "Главная мысль",
          "body": "Этот блок выделяет основной тезис. Красный фон помогает найти его с первого взгляда."
        }
      ],
      "callout": "Дополнительное пояснение или следующий шаг."
    },
    {
      "id": "metrics",
      "kind": "text_blocks",
      "variant": "metrics_band",
      "title": "Показатели с пояснениями",
      "items": [
        {
          "value": "120",
          "title": "Показатель 1",
          "body": "Условные данные для примера"
        },
        {
          "value": "75%",
          "title": "Показатель 2",
          "body": "Условные данные для примера"
        },
        {
          "value": "3,5",
          "title": "Показатель 3",
          "body": "Условные данные для примера"
        },
        {
          "value": "+20%",
          "title": "Показатель 4",
          "body": "Условные данные для примера"
        }
      ],
      "callout": "Здесь размещается вывод по показателям. Все значения вымышлены."
    },
    {
      "id": "text-columns",
      "kind": "text_blocks",
      "variant": "text_columns",
      "title": "Три колонки для развёрнутого текста",
      "items": [
        {
          "title": "Название раздела 1",
          "body": "Первый абзац раскрывает содержание раздела.\n\nВторой абзац добавляет пояснение или условие.\n\nТретий фиксирует важную деталь."
        },
        {
          "title": "Название раздела 2",
          "body": "Первый абзац раскрывает содержание раздела.\n\nВторой абзац добавляет пояснение или условие.\n\nТретий фиксирует важную деталь."
        },
        {
          "title": "Название раздела 3",
          "body": "Первый абзац раскрывает содержание раздела.\n\nВторой абзац добавляет пояснение или условие.\n\nТретий фиксирует важную деталь."
        }
      ]
    }
  ]
}
